{
  "$schema": "http://json-schema.org/draft-04/schema",
  "properties": {
    "attack_skills": {
      "properties": {
        "Blunt Attack": {
          "type": "number"
        },
        "Cannon Attack": {
          "type": "number"
        },
        "Dagger Attack": {
          "type": "number"
        },
        "Fist Attack": {
          "type": "number"
        },
        "Sword Attack": {
          "type": "number"
        }
      },
      "type": "object"
    },
    "exp": {
      "type": "number"
    },
    "magic_skills": {
      "properties": {
        "Earth 2": {
          "type": "number"
        },
        "Earth 3": {
          "type": "number"
        },
        "Fire 1": {
          "type": "number"
        },
        "Fire 2": {
          "type": "number"
        },
        "Fire 3": {
          "type": "number"
        },
        "Fire Arrow": {
          "type": "number"
        },
        "Windwhirl": {
          "type": "number"
        }
      },
      "type": "object"
    },
    "name": {
      "type": "string"
    },
    "stats": {
      "properties": {
        "agility": {
          "type": "number"
        },
        "attack": {
          "type": "number"
        },
        "defence": {
          "type": "number"
        },
        "luck": {
          "type": "number"
        },
        "magic": {
          "type": "number"
        }
      },
      "required": [
        "attack",
        "defence",
        "magic",
        "agility",
        "luck"
      ],
      "type": "object"
    },
    "unique": {
      "type": "boolean"
    }
  },
  "required": [
    "attack_skills",
    "unique",
    "stats",
    "name",
    "exp"
  ],
  "type": "object"
}